{
  "version": "1.0.0",
  "jurisdiction": "BR",
  "purpose": "Normative catalogue definitions for the MEI/ME compliance plane. Applicability and legal conclusions require versioned official sources.",
  "agents": [
    {
      "id": "ComplianceOrchestratorAgent",
      "name": "ComplianceOrchestratorAgent",
      "domain": "governance",
      "description": "Responsável pelo domínio Compliance Orchestrator.",
      "responsibility": "Orquestrar regras, aplicabilidade, evidências, políticas, exceções e auditoria.",
      "inputs": [
        "company_profile",
        "operation_context",
        "evidence_refs"
      ],
      "outputs": [
        "compliance_decisions",
        "evidence_refs",
        "open_findings"
      ],
      "execution_points": [
        "on_ingress",
        "before_egress",
        "between_agents",
        "between_actions",
        "scheduled",
        "on_state_change"
      ]
    },
    {
      "id": "LegalRuleRegistryAgent",
      "name": "LegalRuleRegistryAgent",
      "domain": "governance",
      "description": "Responsável pelo domínio Legal Rule Registry.",
      "responsibility": "Orquestrar regras, aplicabilidade, evidências, políticas, exceções e auditoria.",
      "inputs": [
        "company_profile",
        "operation_context",
        "evidence_refs"
      ],
      "outputs": [
        "compliance_decisions",
        "evidence_refs",
        "open_findings"
      ],
      "execution_points": [
        "on_ingress",
        "before_egress",
        "between_agents",
        "between_actions",
        "scheduled",
        "on_state_change"
      ]
    },
    {
      "id": "ApplicabilityAssessmentAgent",
      "name": "ApplicabilityAssessmentAgent",
      "domain": "governance",
      "description": "Responsável pelo domínio Applicability Assessment.",
      "responsibility": "Orquestrar regras, aplicabilidade, evidências, políticas, exceções e auditoria.",
      "inputs": [
        "company_profile",
        "operation_context",
        "evidence_refs"
      ],
      "outputs": [
        "compliance_decisions",
        "evidence_refs",
        "open_findings"
      ],
      "execution_points": [
        "on_ingress",
        "before_egress",
        "between_agents",
        "between_actions",
        "scheduled",
        "on_state_change"
      ]
    },
    {
      "id": "ComplianceEvidenceAgent",
      "name": "ComplianceEvidenceAgent",
      "domain": "governance",
      "description": "Responsável pelo domínio Compliance Evidence.",
      "responsibility": "Orquestrar regras, aplicabilidade, evidências, políticas, exceções e auditoria.",
      "inputs": [
        "company_profile",
        "operation_context",
        "evidence_refs"
      ],
      "outputs": [
        "compliance_decisions",
        "evidence_refs",
        "open_findings"
      ],
      "execution_points": [
        "on_ingress",
        "before_egress",
        "between_agents",
        "between_actions",
        "scheduled",
        "on_state_change"
      ]
    },
    {
      "id": "ExceptionAndHumanReviewAgent",
      "name": "ExceptionAndHumanReviewAgent",
      "domain": "governance",
      "description": "Responsável pelo domínio Exception And Human Review.",
      "responsibility": "Orquestrar regras, aplicabilidade, evidências, políticas, exceções e auditoria.",
      "inputs": [
        "company_profile",
        "operation_context",
        "evidence_refs"
      ],
      "outputs": [
        "compliance_decisions",
        "evidence_refs",
        "open_findings"
      ],
      "execution_points": [
        "on_ingress",
        "before_egress",
        "between_agents",
        "between_actions",
        "scheduled",
        "on_state_change"
      ]
    },
    {
      "id": "ComplianceMonitoringAgent",
      "name": "ComplianceMonitoringAgent",
      "domain": "governance",
      "description": "Responsável pelo domínio Compliance Monitoring.",
      "responsibility": "Orquestrar regras, aplicabilidade, evidências, políticas, exceções e auditoria.",
      "inputs": [
        "company_profile",
        "operation_context",
        "evidence_refs"
      ],
      "outputs": [
        "compliance_decisions",
        "evidence_refs",
        "open_findings"
      ],
      "execution_points": [
        "on_ingress",
        "before_egress",
        "between_agents",
        "between_actions",
        "scheduled",
        "on_state_change"
      ]
    },
    {
      "id": "PolicyConfigurationAgent",
      "name": "PolicyConfigurationAgent",
      "domain": "governance",
      "description": "Responsável pelo domínio Policy Configuration.",
      "responsibility": "Orquestrar regras, aplicabilidade, evidências, políticas, exceções e auditoria.",
      "inputs": [
        "company_profile",
        "operation_context",
        "evidence_refs"
      ],
      "outputs": [
        "compliance_decisions",
        "evidence_refs",
        "open_findings"
      ],
      "execution_points": [
        "on_ingress",
        "before_egress",
        "between_agents",
        "between_actions",
        "scheduled",
        "on_state_change"
      ]
    },
    {
      "id": "AuditTrailAgent",
      "name": "AuditTrailAgent",
      "domain": "governance",
      "description": "Responsável pelo domínio Audit Trail.",
      "responsibility": "Orquestrar regras, aplicabilidade, evidências, políticas, exceções e auditoria.",
      "inputs": [
        "company_profile",
        "operation_context",
        "evidence_refs"
      ],
      "outputs": [
        "compliance_decisions",
        "evidence_refs",
        "open_findings"
      ],
      "execution_points": [
        "on_ingress",
        "before_egress",
        "between_agents",
        "between_actions",
        "scheduled",
        "on_state_change"
      ]
    },
    {
      "id": "LGPDComplianceAgent",
      "name": "LGPDComplianceAgent",
      "domain": "privacy_lgpd",
      "description": "Responsável pelo domínio LGPDCompliance.",
      "responsibility": "Avaliar e coordenar controles de privacidade, direitos dos titulares e tratamento lícito de dados pessoais.",
      "inputs": [
        "company_profile",
        "operation_context",
        "evidence_refs"
      ],
      "outputs": [
        "compliance_decisions",
        "evidence_refs",
        "open_findings"
      ],
      "execution_points": [
        "on_ingress",
        "before_egress",
        "between_agents",
        "between_actions",
        "scheduled",
        "on_state_change"
      ]
    },
    {
      "id": "DataInventoryAndMappingAgent",
      "name": "DataInventoryAndMappingAgent",
      "domain": "privacy_lgpd",
      "description": "Responsável pelo domínio Data Inventory And Mapping.",
      "responsibility": "Avaliar e coordenar controles de privacidade, direitos dos titulares e tratamento lícito de dados pessoais.",
      "inputs": [
        "company_profile",
        "operation_context",
        "evidence_refs"
      ],
      "outputs": [
        "compliance_decisions",
        "evidence_refs",
        "open_findings"
      ],
      "execution_points": [
        "on_ingress",
        "before_egress",
        "between_agents",
        "between_actions",
        "scheduled",
        "on_state_change"
      ]
    },
    {
      "id": "DataSubjectRightsAgent",
      "name": "DataSubjectRightsAgent",
      "domain": "privacy_lgpd",
      "description": "Responsável pelo domínio Data Subject Rights.",
      "responsibility": "Avaliar e coordenar controles de privacidade, direitos dos titulares e tratamento lícito de dados pessoais.",
      "inputs": [
        "company_profile",
        "operation_context",
        "evidence_refs"
      ],
      "outputs": [
        "compliance_decisions",
        "evidence_refs",
        "open_findings"
      ],
      "execution_points": [
        "on_ingress",
        "before_egress",
        "between_agents",
        "between_actions",
        "scheduled",
        "on_state_change"
      ]
    },
    {
      "id": "ConsentAndLegalBasisAgent",
      "name": "ConsentAndLegalBasisAgent",
      "domain": "privacy_lgpd",
      "description": "Responsável pelo domínio Consent And Legal Basis.",
      "responsibility": "Avaliar e coordenar controles de privacidade, direitos dos titulares e tratamento lícito de dados pessoais.",
      "inputs": [
        "company_profile",
        "operation_context",
        "evidence_refs"
      ],
      "outputs": [
        "compliance_decisions",
        "evidence_refs",
        "open_findings"
      ],
      "execution_points": [
        "on_ingress",
        "before_egress",
        "between_agents",
        "between_actions",
        "scheduled",
        "on_state_change"
      ]
    },
    {
      "id": "RetentionAndDeletionAgent",
      "name": "RetentionAndDeletionAgent",
      "domain": "privacy_lgpd",
      "description": "Responsável pelo domínio Retention And Deletion.",
      "responsibility": "Avaliar e coordenar controles de privacidade, direitos dos titulares e tratamento lícito de dados pessoais.",
      "inputs": [
        "company_profile",
        "operation_context",
        "evidence_refs"
      ],
      "outputs": [
        "compliance_decisions",
        "evidence_refs",
        "open_findings"
      ],
      "execution_points": [
        "on_ingress",
        "before_egress",
        "between_agents",
        "between_actions",
        "scheduled",
        "on_state_change"
      ]
    },
    {
      "id": "DataSharingAndTransferAgent",
      "name": "DataSharingAndTransferAgent",
      "domain": "privacy_lgpd",
      "description": "Responsável pelo domínio Data Sharing And Transfer.",
      "responsibility": "Avaliar e coordenar controles de privacidade, direitos dos titulares e tratamento lícito de dados pessoais.",
      "inputs": [
        "company_profile",
        "operation_context",
        "evidence_refs"
      ],
      "outputs": [
        "compliance_decisions",